STUDY_ID,REVIEWERS,INCLUDE,AUTHORS,TITLE,JOURNAL,VOLUME,LPAGES,UPAGES,DOI,YEAR,ABSTRACT
nagycited14,Guy,NO,"Jaffar, Saleem; Ahmad, Sajjad; Lu, Yongyue",Contribution of insect gut microbiota and their associated enzymes in insect physiology and biodegradation of pesticides,FRONTIERS IN MICROBIOLOGY,13,NA,NA,10.3389/fmicb.2022.979383,2022,"Synthetic pesticides are extensively and injudiciously applied to control agriculture and household pests worldwide. Due to their high use, their toxic residues have enormously increased in the agroecosystem in the past several years. They have caused many severe threats to non-target organisms, including humans. Therefore, the complete removal of toxic compounds is gaining wide attention to protect the ecosystem and the diversity of living organisms. Several methods, such as physical, chemical and biological, are applied to degrade compounds, but as compared to other methods, biological methods are considered more efficient, fast, eco-friendly and less expensive. In particular, employing microbial species and their purified enzymes makes the degradation of toxic pollutants more accessible and converts them into non-toxic products by several metabolic pathways. The digestive tract of insects is usually known as a superior organ that provides a nutrient-rich environment to hundreds of microbial species that perform a pivotal role in various physiological and ecological functions. There is a direct relationship between pesticides and insect pests: pesticides reduce the growth of insect species and alter the phyla located in the gut microbiome. In comparison, the insect gut microbiota tries to degrade toxic compounds by changing their toxicity, increasing the production and regulation of a diverse range of enzymes. These enzymes breakdown into their derivatives, and microbial species utilize them as a sole source of carbon, sulfur and energy. The resistance of pesticides (carbamates, pyrethroids, organophosphates, organochlorines, and neonicotinoids) in insect species is developed by metabolic mechanisms, regulation of enzymes and the expression of various microbial detoxifying genes in insect guts. This review summarizes the toxic effects of agrochemicals on humans, animals, birds and beneficial arthropods. It explores the preferential role of insect gut microbial species in the degradation process and the resistance mechanism of several pesticides in insect species. Additionally, various metabolic pathways have been systematically discussed to better understand the degradation of xenobiotics by insect gut microbial species."
nagycited15,Guy,NO,"Nikbakhtzadeh, Mahmood R.; Fuentes, Yelissa",DETERRENT EFFECTS OF GLYPHOSATE ON OVIPOSITION AND LARVAL DEVELOPMENT OF CULEX QUINQUEFASCIATUS,JOURNAL OF THE AMERICAN MOSQUITO CONTROL ASSOCIATION,38,198,207,,2022,"Glyphosate is one of the most common herbicides used to control weeds in the USA. This herbicide can impact the mosquito life cycle through being carried to mosquito habitats by runoff. This study investigates the effects of glyphosate on the larval development and oviposition of a laboratory colony of Culex quinquefasciatus. Our experiments indicated that a concentration of 1 g/liter glyphosate was lethal to larval instars or the larvae impacted were either unable to molt to pupae or never emerged as adults. Larval instars exposed to 0.5 g/liter glyphosate experienced a similar impact; however, the larval stage was extended and pupation was considerably delayed. Mosquitoes oviposited in 0.5 g/liter glyphosate laid the same number of egg rafts as in water, but a considerably lower number of eggs exposed to glyphosate hatched as first instars. If gravid females laid their eggs in 1 g/liter glyphosate versus water, the difference between the 2 groups would be statistically significant and a very low number of eggs exposed to glyphosate could ever hatch into larvae. In an oviposition assay carried out in a cage with 3 choices of water, 0.5 g/liter, and 1 g/liter glyphosate, a higher number of egg rafts were laid in water, followed by 0.5 g/liter and 1 g/liter glyphosate concentrations, respectively. Our study indicated such a severe effect of glyphosate on all immature stages of Cx. quinquefasciatus that no adult could ever emerge."
nagycited16,Guy,YES,"Jorge-Escudero, Gabriella; Polanco, Mariana Perez; Lagerlof, Jan Erland; Perez, Carlos Alberto; Miguez, Diana",Commercial Fungicide Toxic Effects on Terrestrial Non-Target Species Might Be Underestimated When Based Solely on Active Ingredient Toxicity and Standard Earthworm Tests,TOXICS,10,NA,NA,10.3390/toxics10090488,2022,"The ecosystem services provided by earthworms are lost when land management reduces their populations, hence, the importance of thorough assessments of management effects on this group. The present study aimed to: (1) review the possible influence of other ingredients within the formulations of two commercial fungicides; (2) assess the sublethal effects of these commercial fungicides on Eisenia fetida; and (3) assess the acute lethal effects of one commercial fungicide on both Glossoscolex none and E. fetida. Examining all components of the studied commercial formulations revealed that alongside the toxic active ingredients are other ingredients that are equally as or more toxic than the former and may even be in higher concentrations. The inhibition concentration of 10% of E. fetida's progeny (IC10) was estimated at 133 mg kg(-1) for PROSARO (R) and 1544 mg kg(-1) for SWING PLUS (R). Both fungicides showed an effect of hormesis on the progeny. In this first toxicity study with G. nione, it was found that this species is more sensitive to PROSARO (R) than E. fetida, with preliminary 14 day-lethal concentrations of 285 mg kg(-1) for the former and >1000 mg kg(-1) for the latter."
nagycited17,Guy,NO,"Carvalho, Rui P.; Vieira dos Santos, M. Clara; Almeida, M. Teresa M.; Costa, Sofia R.",Effects of commercial pesticides on the nematode biological control agent Pochonia chlamydosporia,BIOCONTROL SCIENCE AND TECHNOLOGY,32,1220,1231,10.1080/09583157.2022.2108759,2022,"Tomato Solanum lycopersicum plants are exposed to a wide range of pests and diseases in protected cultivation, including root-knot nematodes (RKN), Meloidogyne spp. As the application of chemical nematicides is progressively being restricted in the EU, biological control agents such as Pochonia chlamydosporia are being considered as sustainable alternatives. Nevertheless, success in the control of RKN depends on the compatibility of the fungus with pesticides used to manage other pests and diseases. We tested the in vitro acute and chronic effects of twelve different commercial pesticides used throughout a tomato cropping cycle on P. chlamydosporia. All pesticides significantly inhibited radial growth of the fungus at 22 days, with exception of methiocarb (Mesurol 200), spiromesifen (Oberon), copper-metalaxyl-M (Ridomil Gold R) and oxamyl (Vydate 10L). All fungicides produced significant acute and chronic negative effects on chlamydospore viability. Insecticides methiocarb, spinosad (Spintor) and indoxacarb (Steward) did not affect chlamydospore germination at the tested concentration of active substance (100 mg center dot L-1) of pesticide in the acute effects test, but all tested pesticides significantly reduced chlamydospore viability in the chronic 6-week-exposure test. Importantly, chlamydospore germination rates recorded were higher in the 12-week than in the 6-week-exposure chronic test, hinting at P. chlamydosporia acclimation or recovery. In view of differences in compatibility of commercial pesticides with P. chlamydosporia, acting on different fungal life stages in acute and chronic processes, these must be carefully selected and the timing of their application considered in the design of crop protection strategies against RKN to improve the biological control success."
nagycited18,Guy,NO,"Mosallanejad, Hadi; Broomand, Asghar","Effects of a multi-functional adjuvant on efficacy of methoxyfenozide (SC24%) and spinosad (SC24%) to control the European grapevine moth, Lobesia botrana",Bulletin OEPP,52,NA,NA,10.1111/epp.12860,2022,"The study was undertaken to evaluate the effects of a multi-functional adjuvant on the field efficacy of two insecticides, methoxyfenozide (SC24%) and spinosad (SC24%), against Lobesia botrana in Iran. The efficacy was evaluated from the experimental plots at 3, 7, 14 and 21 days after treatment. Our results indicated that the adjuvant was able to enhance the efficacy of both methoxyfenozide and spinosad against L. botrana at each interval. The increased efficacy was due to the lower values of surface tension and to the improved contact angle parameters of the spray solutions. By adding adjuvant in the spraying liquid, it was possible to have a control efficiency very similar to the treatment using the recommended rates, even when the application rate was reduced by 20%. Our results underline the importance of adjuvants in improving the field efficacy of insecticides against L. botrana."
nagycited19,Guy,NO,"Cox, Caroline; Zeiss, Michael","Health, Pesticide Adjuvants, and Inert Ingredients: California Case Study Illustrates Need for Data Access",ENVIRONMENTAL HEALTH PERSPECTIVES,130,NA,NA,10.1289/EHP10634,2022,"BACKGROUND: Many pesticide products are mixtures of multiple chemicals. These include active ingredients intended to kill pests, and so-called inert ingredients intended to improve the physical characteristics of the product. In addition, shortly before applying a pesticide product, applicators often mix adjuvants into the sprayer tank. Adjuvants are products designed to improve the performance or physical properties of a pesticide spray mixture. Manufacturers may use a particular chemical compound both as an inert ingredient within pesticide products and as a component of adjuvant products. Nonetheless, regulations dictate that data on use are publicly available only for the portion used in adjuvants. Adjuvants are exempt from federal registration, but are defined as pesticides in California. Based on that definition, California has identified a-(p-nonylphenyl)-x-hydroxypoly(oxyethylene) (APNOHO) as the most widely used pesticide in the state, applied to more than 10 million acres annually. That quantified use includes only agricultural acres treated with adjuvants containing APNOHO. Total APNOHO use is likely higher because manufacturers also use the chemical as an inert ingredient within pesticide products, although data on such use are shielded by regulation. OBJECTIVES: We use APNOHO as a case study to demonstrate that the use of adjuvants and inert ingredients is difficult to track because relevant information is not publicly available. We synthesize information that suggests widespread agricultural use of alkylphenol ethoxylates, such as APNOHO, may pose significant human and environmental health risks. We then make recommendations for future research and policy. METHODS: We used information from California???s pesticide use reporting system and the U.S. Environmental Protection Agency (EPA) to estimate use of APNOHO. We used U.S. EPA and European databases, as well as published research, to identify human and environmental health hazards of APNOHO. We focused on research showing that APNOHO is an endocrine-disrupting chemical. DISCUSSION: Within California, APNOHO is applied in more than 150 adjuvant products. Nationwide, it is used as an inert ingredient in at least 650 pesticide products. Exposure to APNOHO is associated with endocrine disruption, birth defects, and aquatic toxicity. We suggest that the case of APNOHO illustrates the larger problem of a lack of publicly available data on use and toxicity of many adjuvants and pesticide inert ingredients. We recommend that researchers and regulators include adjuvants and inert ingredients when evaluating pesticide hazards, including endocrine disruption. We also recommend regulatory requirements to identify all ingredients on product labels. https://doi.org/10.1289/EHP10634"
nagycited20,Guy,maybe,"Freeman, Laura E. Beane",Invited Perspective: Pesticide Adjuvants and Inert Ingredients - A Missing Piece of the Puzzle,ENVIRONMENTAL HEALTH PERSPECTIVES,130,NA,NA,10.1289/EHP11512,2022,
nagycited21,Guy,NO,"Shi, Liyin; Yan, Weiyao; Sun, Li; Hou, Chaoqun; Wei, Nuo; Chen, Zhiyang; Feng, Jianguo",Preparation and characterization of emamectin benzoate nanocapsules based on the dual role of polydopamine,PEST MANAGEMENT SCIENCE,78,4407,4416,10.1002/ps.7061,2022,"Background Developing pesticide-controlled release formulations with foliage adhesion has become the focus of current research in the field of crop protection. In this study, an excellent adhesive nanocapsule loaded with emamectin benzoate (Eb@PDA) was prepared via emulsion interfacial polymerization based on the self-polymerization ability and adhesion properties of polydopamine (PDA). Results The physicochemical properties of the Eb@PDA were characterized by scanning electron microscopy, transmission electron microscopy, particle size statistics, Fourier transform infrared spectroscopy and X-ray diffraction. The Eb@PDA presented a regular spherical shape, with an average particle size of 163.8 nm. Compared with conventional formulations, it had higher pesticide-loading content (34%) and excellent adhesion onto corn leaf. In addition, Eb@PDA showed sustained-release characteristics, facilitating the release of Eb at low pH and high temperature. Eb@PDA could effectively protect Eb against photodegradation and had a longer effective period for controlling Spodoptera frugiperda and Spodoptera exigua. Furthermore, acute toxicity tests showed that the 50% lethal concentration (LC50) was 80.91 and 57.91 mg kg(-1) at 7 and 14 days, respectively, indicating a lower toxicity of the Eb@PDA to earthworms. The cells (L02) treated with Eb@PDA showed a higher cell viability but a lower apoptosis rate (only 5.75%), demonstrating the lower cytotoxicity of the Eb@PDA. Conclusion The self-prepared Eb@PDA could be used as a formulation with the advantages of slow release, UV shielding, strong leaf adhesion, superior insecticidal properties, sustained effectiveness and biosafety. It will also facilitate the development of an efficient and safe pesticide delivery system. (c) 2022 Society of Chemical Industry."
nagycited22,Guy,NO,"Maldonado-Reina, Antonio Jesus; Lopez-Ruiz, Rosalia; Romero-Gonzalez, Roberto; Vidal, Jose Luis Martinez; Garrido-Frenich, Antonia",Assessment of Co-Formulants in Marketed Plant Protection Products by LC-Q-Orbitrap-MS: Application of a Hybrid Data Treatment Strategy Combining Suspect Screening and Unknown Analysis,JOURNAL OF AGRICULTURAL AND FOOD CHEMISTRY,70,7302,7313,10.1021/acs.jafc.2c01152,2022,"The aim of this study was the determination of co-formulants in 15 different chlorantraniliprole- and difenoconazole-based plant protection products (PPPs) belonging to different formulations. Samples were analyzed by ultrahigh-performance liquid chromatography coupled to Q-Orbitrap high-resolution mass accuracy spectrometry (UHPLC-Q-Orbitrap-MS), operating in full-scan MS and data-dependent acquisition (ddMS(2)) modes. A total of 78 co-formulants were tentatively identified by a combination of suspect screening and unknown analysis. Nine of them were later confirmed by analytical standards. Finally, the analytical method was successfully validated and co-formulants were quantified. Linear alkyl ethoxylates (LAS) were the most common type of co-formulant, followed by sodium alkylbenzene sulfonates. Moreover, sodium dodecyl benzene sulfonate had the highest concentration of any co-formulant (up to 32.33 g/L). In all, an innovative identification of co-formulants in a large number of PPPs is presented, which will give room for future studies delving into the composition of PPPs or determining these co-formulants in environmental or agricultural samples."
nagycited23,Guy,NO,"Moser, Virginia C.; Morris-Schaffer, Keith; Richardson, Jason R.; Li, Abby A.",Glyphosate and neurological outcomes: A systematic literature review of animal studies,JOURNAL OF TOXICOLOGY AND ENVIRONMENTAL HEALTH-PART B-CRITICAL REVIEWS,25,162,209,10.1080/10937404.2022.2083739,2022,"Studies of nervous system effects of glyphosate, a widely used herbicide, have not been critically examined. The aim of this paper was to systematically review glyphosate-induced neurotoxicity literature to determine its usefulness in regulatory decision-making. The review was restricted to mammalian studies of behavior, neuropathology, and neuropharmacology; in vitro and other biochemical studies were considered supplementary information. Glyphosate formulation studies were also considered, despite uncertainties regarding toxicities of the formulated products; no studies used a formulation vehicle as the control. Inclusion criteria were developed a priori to ensure consistent evaluation of studies, and in vivo investigations were also ranked using ToxRTool software to determine reliability. There were 27 in vivo studies (open literature and available regulatory reports), but 11 studies were considered unreliable (mostly due to critical methodological deficiencies). There were only seven acceptable investigations on glyphosate alone. Studies differed in terms of dosing scenarios, experimental designs, test species, and commercial product. Limitations included using only one dose and/or one test time, small sample sizes, limited data presentation, and/or overtly toxic doses. While motor activity was the most consistently affected endpoint (10 of 12 studies), there were considerable differences in outcomes. In six investigations, there were no marked neuropathological changes in the central or peripheral nervous system. Other neurological effects were less consistent, and some outcomes were less convincing due to influences including high variability and small effect sizes. Taken together, these studies do not demonstrate a consistent impact of glyphosate on the structure or function of the mammalian nervous system."
nagycited24,Guy,NO,"Shen, Yike; Zhao, Ercheng; Zhang, Wei; Baccarelli, Andrea A.; Gao, Feng",Predicting pesticide dissipation half-life intervals in plants with machine learning models,JOURNAL OF HAZARDOUS MATERIALS,436,NA,NA,10.1016/j.jhazmat.2022.129177,2022,"Pesticide dissipation half-life in plants is an important factor to assessing environmental fate of pesticides and establishing pre-harvest intervals critical to good agriculture practices. However, empirically measured pesticide dissipation half-lives are highly variable and the accurate prediction with models is challenging. This study utilized a dataset of pesticide dissipation half-lives containing 1363 datapoints, 311 pesticides, 10 plant types, and 4 plant component classes. Novel dissipation half-life intervals were proposed and predicted to account for high variations in empirical data. Four machine learning models (i.e., gradient boosting regression tree [GBRT], random forest [RF], supporting vector classifier [SVC], and logistic regression [LR]) were developed to predict dissipation half-life intervals using extended connectivity fingerprints (ECFP), temperature, plant type, and plant component class as model inputs. GBRT-ECFP had the best model performance with F1-microbinary score of 0.698 +/- 0.010 for the binary classification compared with other machine learning models (e.g., LR-ECFP, F1-micro binary= 0.662 +/- 0.009). Feature importance analysis of molecular structures in the binary classification identified aromatic rings, carbonyl group, organophosphate, =C-H, and N-containing heterocyclic groups as important substructures related to pesticide dissipation half-lives. This study suggests the utility of machine learning models in assessing the environmental fate of pesticides in agricultural crops."
nagycited25,Guy,YES,"Bordin, Eduarda Roberta; Munhoz, Renan Cesar; Panicio, Paloma Pucholobeck; de Freitas, Adriane Martins; Ramsdorf, Wanessa Algarte","Effects of environmentally relevant concentrations of atrazine and glyphosate herbicides, isolated and in mixture, on two generation of the freshwater microcrustacean Daphnia magna",ECOTOXICOLOGY,31,884,896,10.1007/s10646-022-02554-2,2022,"The herbicides atrazine and glyphosate are used worldwide and their excessive usage results in the frequent presence of these pesticides in environmental compartments. We evaluated the effects of environmentally relevant concentrations of analytical standards and commercial formulations of atrazine (2 mu g L-1) and glyphosate (65 mu g L-1), isolated and in mixture (2 + 65 mu g L-1) on the microcrustacean Daphnia magna. Through chronic exposure (21 days) of two generations, we observed effects on survival, reproductive capacity and responses of the antioxidant defense system (catalase) and biotransformation system (glutathione S-transferase). The survival of organisms was affected in the second generation (F1) with a mortality of 17% in the mixture of commercial formulations treatments. In the evaluation of the first generation (F0) we observed only effects on sexual maturation of organisms, while in the F1, changes were observed in all parameters evaluated. A statistical difference (p < 0.05) was also observed between the analytical standards and the commercial formulations for all parameters evaluated, indicating that other components present in the formulations can change the toxicity of products. We suggest that atrazine can modulate toxicity when mixed with glyphosate, as the standard analytical atrazine and mixture of analytical standards results were similar in most parameters. Given the difficulty in estimating effects of mixtures and considering that various stressors are found in the environment, our results support the need to carry out long-term studies and, above all, to verify what are the impacts across generations, so that the toxicity of products is not underestimated.[GRAPHICS]."
nagycited26,Guy,NO,"Ngoc Tuan Nguyen; Van Tam Vo; The Hong Phong Nguyen; Kiefer, Rudolf",Isolation and optimization of a glyphosate-degrading Rhodococcus soli G41 for bioremediation,ARCHIVES OF MICROBIOLOGY,204,NA,NA,10.1007/s00203-022-02875-0,2022,"A widely used herbicide for controlling weeds, glyphosate, is causing environmental pollution. It is necessary to remove it from environment using a cost-effective and eco-friendly method. The aims of this study were to isolate glyphosate-degrading bacteria and to optimize their degradative conditions required for bioremediation. Sixteen bacterial strains were isolated through enrichment and one strain, Rhodococcus soli G41, demonstrated a high removal rate of glyphosate than other strains. Response surface methodology was employed to optimize distinct environmental factors on glyphosate degradation of G41 strain. The optimal conditions for the maximum glyphosate degradation were found to have the NH4Cl concentration of 0.663% and glyphosate concentration of 0.115%, resulting in a maximum degradation of 42.7% after 7 days. Bioremediation analysis showed 47.1% and 40% of glyphosate in unsterile soil and sterile soil was removed by G41 strain after 14 days, respectively. The presence of soxB gene in G41 strain indicates that the glyphosate is degraded via the eco-friendly sarcosine pathway. The results indicated that G41 strain has the potential to serve as an in-situ candidate for bioremediation of glyphosate polluted environments."
nagycited27,Guy,NO,"da Silva Martins, Dayse Carvalho; Resende, Iasmin Tavares; Rocha da Silva, Bruno Jose",Degradation features of pesticides: a review on (metallo)porphyrin-mediated catalytic processes,ENVIRONMENTAL SCIENCE AND POLLUTION RESEARCH,29,42384,42403,10.1007/s11356-022-19737-3,2022,"Pesticides have been used to kill pests such as insects, fungi, rodents, and unwanted plants. Since these compounds are potentially toxic to the target organisms, they could also be harmful to human health and the environment. Several chronic adverse effects have been identified even after months or years of exposure. A few pesticide degradation processes have been studied including adsorption, homogeneous and heterogeneous (photo)catalytic oxidation, and biological methods. Although these methods have been playing a significant part in the pesticide's degradation, there are still gaps in many aspects. Here, we review the catalytic degradation of these pollutants by (metallo)porphyrins. To evaluate the P450 cytochrome's biomimetic behavior of these catalysts, various synthesized porphyrins have been used since 1999 and their activities were summarized in this manuscript. The porphyrins appear to act as good catalysts for the degradation of pesticides; in fact, they also have been shown as a useful tool for the elucidation of their degradation products. Achieving pesticide mineralization without intermediate products is still challenging, although the ability of this kind of catalysts to conduct the formation of some lower toxic products comparing their precursors has been verified."
