STUDY_ID,REVIEWERS,INCLUDE,AUTHORS,TITLE,JOURNAL,VOLUME,LPAGES,UPAGES,DOI,YEAR,ABSTRACT
nagycited55,Guy,NO,"Straw, Edward A.; Carpentier, Edward N.; Brown, Mark J. F.",Roundup causes high levels of mortality following contact exposure in bumble bees,JOURNAL OF APPLIED ECOLOGY,58,1167,1176,10.1111/1365-2664.13867,2021,"Pollinators underpin global food production, but they are suffering significant declines across the world. Pesticides are thought to be important drivers of these declines. Herbicides are the most widely applied type of pesticides and are broadly considered 'bee safe' by regulatory bodies who explicitly allow their application directly onto foraging bees. We aimed to test the mortality effects of spraying the world's most popular herbicide brand (Roundup(R)) directly onto bumble bees Bombus terrestris audax.We used three Roundup(R) products, the consumer products Roundup(R) Ready-To-Use and Roundup(R) No Glyphosate, the agricultural product Roundup(R) ProActive, as well as another herbicide with the same active ingredient (glyphosate), Weedol(R). Label recommended pesticide concentrations were applied to the bees using a Roundup(R) Ready-To-Use spray bottle.Bees exhibited 94% mortality with Roundup(R) Ready-To-Use(R) and 30% mortality with Roundup(R) ProActive(R), over 24 hr. Weedol(R) did not cause significant mortality, demonstrating that the active ingredient, glyphosate, is not the cause of the mortality. The 96% mortality caused by Roundup(R) No Glyphosate supports this conclusion. Dose-dependent mortality caused by Roundup(R) Ready-To-Use, further confirms its acute toxicity. Roundup(R) products caused comprehensive matting of bee body hair, suggesting that surfactants, or other co-formulants in the Roundup(R) products, may cause death by incapacitating the gas exchange system.These mortality results demonstrate that Roundup(R) products pose a significant hazard to bees, in both agricultural and urban systems, and that exposure of bees to them should be limited.Synthesis and applications. Surfactants, or other co-formulants, in herbicides and other pesticides may contribute to global bee declines. We recommend that, as a precautionary measure until co-formulant identities are made public, label guidelines for all pesticides be altered to explicitly prohibit application to plants when bees are likely to be foraging on them. As current regulatory topical exposure toxicity testing inadequately assesses toxicity of herbicide products, we call for pesticide companies to release the full list of ingredients for each pesticide formulation, as lack of access to this information hampers research to determine safe exposure levels for beneficial insects in agro-ecosystems."
nagycited56,Guy,NO,"Bordalo, Maria D.; Machado, Ana L.; Campos, Diana; Coelho, Sonia D.; Rodrigues, Andreia C. M.; Lopes, Isabel; Pestana, Joao L. T.",Responses of benthic macroinvertebrate communities to a Bti-based insecticide in artificial microcosm streams,ENVIRONMENTAL POLLUTION,282,NA,NA,10.1016/j.envpol.2021.117030,2021,"Bioinsecticides based on the bacterium Bacillus thuringiensis subsp. israelensis (Bti) are increasingly being applied directly into aquatic compartments to control nuisance mosquitoes and blackflies and are generally considered environmentally friendly alternatives to synthetic insecticides. Bti-based insecticides are considered highly selective, being Diptera-specific, and supposedly decompose rapidly in the environment. Nevertheless, their safety to non-target species and freshwater ecosystems has been questioned by recent studies, which in fact document possible indirect effects in aquatic food webs such as the decrease of prey availability to predators. This work aimed to evaluate the potential effects of a Bti-based insecticide (VectoBac (R) 12AS) on a freshwater macroinvertebrate community and on stream ecological functions by using artificial microcosm streams. Artificial microcosm streams were colonized with a macroinvertebrate community plus periphyton collected in a stream together with Alnus glutinosa leaf packs. They were exposed for 7 days to different Bti treatments (0, 12, 120, 1200 mu g/L), which are within the recommended concentrations of application in aquatic compartments for blackfly and mosquito control. Besides invertebrate community structure and abundance, effects were evaluated regarding leaf decomposition and primary production as measures of ecosystem functioning. Community structure was significantly altered in all Bti treatments after 7 days of exposure, mostly due to a decline in chironomids, followed by oligochaetes, which both belong to the deposit-feeders' functional group. Direct effects on oligochaetes are surprising and require further research. Also, reductions of leaf decomposition due to Bti-induced sublethal effects on shredders (reduced feeding) or mortality of chironomids (that can also feed on coarse organic matter) observed in our study, represent potential indirect effects of Bti in aquatic ecosystems. Our short-exposure experiment evidenced some negative effects on stream benthic invertebrate communities and on ecosystem functioning that must be considered whenever Bti is used in water bodies for blackfly or mosquito control programs. (C) 2021 Elsevier Ltd. All rights reserved."
nagycited57,Guy,NO,"Feng, Jianguo; Ma, Yingjian; Chen, Zhiyang; Liu, Qi; Yang, Jinghan; Gao, Yuan; Chen, Wang; Qian, Kun; Yang, Wenchao","Development and Characterization of Pyriproxyfen-Loaded Nanoemulsion for Housefly Control: Improving Activity, Reducing Toxicity, and Protecting Ecological Environment",ACS SUSTAINABLE CHEMISTRY & ENGINEERING,9,4988,4999,10.1021/acssuschemeng.0c08105,2021,"Nanoemulsion provides an effective way for the efficient, safe, and environmentally friendly use for pesticides. In this study, the influence of the type, dosage of emulsifier, and emulsifying process on the formation and stability of nanoemulsion were investigated. On this basis, the optimal nanoemulsion formula loaded with pyriproxyfen was obtained. Pyriproxyfen (5%) and polyoxyethylene castor oil ether (6%; EL-20) were dissolved in hydrocarbon solvent (5%; S-100) with deionized water replenished to 100%. Compared with oil-in-water emulsion (EW) and emulsifiable concentrate (EC), the longest drying time ensured that the nanoemulsions had a more durable control effect. The pyriproxyfen-loaded nanoemulsions had a high pupation inhibition rate and 100% eclosion inhibition rate. In addition, at 7 and 14 days, the 50% lethal concentrations (LC50) of pyriproxyfen-loaded nanoemulsions to Eisenia fetida were 1450.63 and 804.19 mg/kg, respectively, indicating their low acute toxicity to earthworms and environmental friendliness. Moreover, the pyriproxyfen-loaded nanoemulsions showed a low apoptosis rate (5.29%), whose value was considerably lower than that of EW (29.51%) and EC (9.45%), indicating a low toxicity to human hepatocyte L02 cells. This research facilitated the design and fabrication of nanoemulsions for water-insoluble pesticides to enhance the insecticidal activity, lower the cytotoxicity, and reduce environmental pollution of such chemicals."
nagycited58,Guy,NO,"Tang, Gang; Tian, Yuyang; Niu, Junfan; Tang, Jingyue; Yang, Jiale; Gao, Yunhao; Chen, Xi; Li, Xuan; Wang, Huachen; Cao, Yongsong",Development of carrier-free self-assembled nanoparticles based on fenhexamid and polyhexamethylene biguanide for sustainable plant disease management,GREEN CHEMISTRY,23,2531,2540,10.1039/d1gc00006c,2021,"The utilization of nanotechnology for the design of pesticide formulations has enormous potential to enhance the efficiency of pesticides and reduce their adverse impacts on the environment. However, the complicated fabrication process of nanosized carriers and their multi-step chemical modifications greatly restrict the practical applications of nanocarrier-based formulations. To address these issues, herein, self-assembled nanoparticles (NPs) based on fungicide fenhexamid (FHA) and polyhexamethylene biguanide (PHMB) were constructed by the electrostatic and hydrophobic interactions between FHA and PHMB in water solution without using carriers or adjuvants. The optimal temperature and mass ratio between FHA and PHMB for the formation of NPs were 60 degrees C and 10 : 7, respectively. Obtained spherical NPs with sizes of 50-250 nm were stable in neutral and acidic aqueous mediums and displayed desirable physicochemical properties (strong surface positive charges, low conductivity, high light stability, and good surface activity). Moreover, the combination of FHA and PHMB by the self-assembly of NPs had a synergistic effect on the antimicrobial activity, and NPs exhibited higher activities against Pseudomonas syringae pv. lachrymans, Botrytis cinerea, and Sclerotinia sclerotiorum than FHA and PHMB. Furthermore, the results of the genotoxicity evaluation in Vicia faba showed that the prepared NPs did not further increase the cytotoxicity of FHA. Overall, the formation of co-self-assembly nanoparticles of FHA and PHMB via a simple and green approach may be a novel avenue for sustainable plant disease management and provides inspiration to construct new nano-based pesticide formulations."
nagycited59,Guy,NO,"da Silva Pinto, Thandy Junio; Moreira, Raquel Aparecida; da Silva, Lais Conceicao Menezes; Yoshii, Maria Paula Cardoso; Goulart, Bianca Veloso; Fraga, Priscille Dreux; da Silva Rolim, Victor Luiz; Montagner, Cassiana Carolina; Daam, Michiel Adriaan; Espindola, Evaldo Luiz Gaeta","Toxicity of fipronil and 2,4-D formulations (alone and in a mixture) to the tropical amphipod Hyalella meinerti",ENVIRONMENTAL SCIENCE AND POLLUTION RESEARCH,28,38308,38321,10.1007/s11356-021-13296-9,2021,"Conventional farming uses a large volume of pesticides that may reach aquatic ecosystems. This is also the case for the insecticide fipronil and the herbicide 2,4-D, which are widely used in many crops. This study aimed at evaluating the individual and mixture toxicity of these pesticides to the tropical amphipod Hyalella meinerti. To this end, acute toxicity tests (96 h) were conducted. Chronic bioassays (10 days) were also carried out, in which the body length and dry biomass were evaluated as endpoints. In addition, a complete factorial mixture chronic toxicity test was carried out. H. meinerti was sensitive to fipronil in the acute toxicity tests, with a LC50-96-h of 0.86 mu g L-1 (95% CI 0.26-0.46), and no acute effects were observed after 2,4-D exposure even at the highest test concentration of 100 mg L-1. In the chronic toxicity tests, all tested concentrations of both pesticides decreased the growth of H. meinerti, in which losses on biomass reached 45% and 65% for 2,4-D and fipronil, respectively. The pesticide mixture indicated antagonism although it still significantly decreased the body growth. The results obtained indicate a high sensitivity of H. meinerti exposed to environmentally realistic concentrations, demonstrating that there are risks for the species in real field conditions."
nagycited60,Guy,YES,"Lackmann, Carina; Velki, Mirna; Bjedov, Dora; Ecimovic, Sandra; Seiler, Thomas-Benjamin; Hollert, Henner",Commercial preparations of pesticides exert higher toxicity and cause changes at subcellular level in earthworm Eisenia andrei,ENVIRONMENTAL SCIENCES EUROPE,33,NA,NA,10.1186/s12302-021-00455-5,2021,"Background The environmental impact of pesticides has been an increasingly discussed issue over the last decades. Constant usage of pesticides presents a burden for soil and causes a decrease in its health, including the negative effects on earthworms which are indicators for soil quality. The objective of this research was the assessment of the effects of two insecticides and two herbicides on the earthworm Eisenia andrei. Namely, the following active ingredients and respective commercial preparations were investigated: esfenvalerate (Sumialfa), thiacloprid (Calypso), dimethenamid-p (Frontier) and prosulfocarb (Filon). Lethal concentrations (48 h) of both active ingredient and commercial preparations were determined using the filter paper contact test. Results The results showed that Calypso and Frontier were significantly more toxic than the active ingredient. Therefore, all further measurements were performed after exposure of earthworms to the commercial preparations of the pesticides. Specifically, several enzymatic biomarkers and multixenobiotic resistance activity were assessed. Additionally, a fluorescence-based assay for the determination of oxidative stress was established. Significant changes were detected for catalase, carboxylesterase and multixenobiotic activities after 48-h exposures. Also, a significant change in oxidative stress parameters could be observed for both Calypso and Frontier. Conclusions The obtained results show that commercial preparations can be more toxic than the active ingredients, and the formulations being distributed in the environment can affect earthworms on a molecular level already after short exposures. This emphasizes the importance of a more integrated eco-toxicological assessment of commercial pesticide preparations not to underestimate their effects on the environment."
nagycited61,Guy,NO,"da Silva Pinto, Thandy Junio; Moreira, Raquel Aparecida; Menezes da Silva, Lais Conceicao; Cardoso Yoshii, Maria Paula; Goulart, Bianca Veloso; Fraga, Priscille Dreux; Montagner, Cassiana Carolina; Daam, Michiel Adriaan; Gaeta Espindola, Evaldo Luiz","Impact of 2,4-D and fipronil on the tropical midge Chironomus sancticaroli (Diptera: Chironomidae)",ECOTOXICOLOGY AND ENVIRONMENTAL SAFETY,209,NA,NA,10.1016/j.ecoenv.2020.111778,2021,"Increased use of pesticides in conventional agriculture implies potential risks to the environment. In aquatic ecosystems, benthic organisms may be exposed to pesticides via contaminated water and sediment, leading to several potential cascading effects on the food web. The aim of this study was to assess the functional implications of environmental realistic concentrations of the herbicide 2,4-D and the insecticide fipronil (alone and in combination) to the native tropical chironomid Chironomus sancticaroli. These two pesticides are widely applied to different crops and have frequently been detected (together) in surface water bodies in Brazil and elsewhere. Commercial products containing fipronil (Regent (R) 800WG) and 2,4-D (DMA (R) 806BR) were evaluated in 8-day toxicity tests for their effects on larval survival, growth (body length and biomass), head capsule width, development, and mentum deformities. Fipronil decreased the larval survival at the highest test concentration and the effective concentrations (EC) after eight days of exposure were: EC10 = 0.48 mu g L-1 (0.395-0.565), EC20 = 1.06 mu g L-1 (0.607-1.513), and EC50 = 3.70 mu g L-1 (1.664-5.736). All sublethal test concentrations of fipronil decreased the larval growth, causing reductions in biomass up to 72%. The two highest test concentrations of fipronil decreased the head capsule width and after exposure to 3.7 mu g fipronil L-1, only half of the larvae reached the fourth instar. The incidence of deformities was increased by fipronil in a concentration dependent manner with an increase ranging from 23% to 75%. The highest test concentration of 2.4-D (426 mu g L-1) decreased the head capsule width, but larval development was unaffected at all concentrations evaluated. In the mixture tests, antagonism was observed at lower fipronil concentrations and synergism at higher fipronil concentrations for growth. The incidence of deformities rose with increasing fipronil concentrations. The results showed that environmental realistic concentrations of fipronil may have serious ecological implications for C. sancticaroli populations and that a mixture with the herbicide 2,4-D can have synergistic effects, potentiating the risks to the aquatic ecosystem."
nagycited62,Guy,NO,"Belen Poliserpi, Maria; Sebastian Cristos, Diego; Celine Brodeur, Julie",Imidacloprid seed coating poses a risk of acute toxicity to small farmland birds: A weight-of-evidence analysis using data from the grayish baywing Agelaioides badius,SCIENCE OF THE TOTAL ENVIRONMENT,763,NA,NA,10.1016/j.scitotenv.2020.142957,2021,"The aim of this study was to estimate the risk posed by imidacloprid (IMI) seed coating to passerine birds of the Pampa Region of Argentina using data specifically generated with the grayish baywing (Agelaioides badius). Median lethal dose (LD50) of the IMI-based formulation tested was 57.11 mg IMI/kg body weight (bw), with intoxication signs starting from 20.6 mg IMI/kg bw. The feed intake rale (FIR) was estimated experimentally as 4.895 g/day per bird, representing 12.43% of bw. It was calculated that the ingestion of 7-10% of the FIR as treated seeds would be enough to achieve the LD50 for sorghum, corn, sunflower, and alfalfa, whereas consumption of 31 and 54% of FIR was necessary for oat and wheat, respectively. Based on spill data values available in the literature, it was calculated that, for most crops, a baywing would have to forage an area of field corresponding to less than 60 m(2) to obtain the number of seeds required to reach the LD50. It was also shown that this number of seeds is coherent with the amount of seeds ingested in a bout. In a pilot study, all grayish baywings fed with millet seeds treated with 3 g IMI/kg died within three to five days of exposure. In Tier I risk assessment, the trigger value was achieved for all crops except soybean and a weight-of-evidence risk assessment was performed. All lines of evidence examined are consistent with the view that grayish baywings, and probably other small farmland birds, are exposed to a risk of acute toxicity and mortality under both worst-case and mixed-ration exposure scenarios. The possible impacts on bird species calls for an urgent reconsideration of IMI seed coating practices currently approved in the Pampa Region of Argentina and the various parts of the world where this practice is still in use. (C) 2020 Elsevier B.V. All rights reserved."
nagycited63,Guy,NO,"Rodriguez-Gil, Jose Luis; Prosser, Ryan S.; Duke, Stephen O.; Solomon, Keith. R.","Ecotoxicology of Glyphosate, Its Formulants, and Environmental Degradation Products","REVIEWS OF ENVIRONMENTAL CONTAMINATION AND TOXICOLOGY, VOL 255: GLYPHOSATE",255,129,205,10.1007/398_2020_56,2021,"The chemical and biological properties of glyphosate are key to understanding its fate in the environment and potential risks to non-target organisms. Glyphosate is polar and water soluble and therefore does not bioaccumulate, biomagnify, or accumulate to high levels in the environment. It sorbs strongly to particles in soil and sediments and this reduces bioavailability so that exposures to non-target organisms in the environment are acute and decrease with half-lives in the order of hours to a few days. The target site for glyphosate is not known to be expressed in animals, which reduces the probability of toxicity and small risks. Technical glyphosate (acid or salts) is of low to moderate toxicity; however, when mixed with some formulants such as polyoxyethylene amines (POEAs), toxicity to aquatic animals increases about 15-fold on average. However, glyphosate and the formulants have different fates in the environment and they do not necessarily co-occur. Therefore, toxicity tests on formulated products in scenarios where they would not be used are unrealistic and of limited use for assessment of risk. Concentrations of glyphosate in surface water are generally low with minimal risk to aquatic organisms, including plants. Toxicity and risks to non-target terrestrial organisms other than plants treated directly are low and risks to terrestrial invertebrates and microbial processes in soil are very small. Formulations containing POEAs are not labeled for use over water but, because POEA rapidly partitions into sediment, risks to aquatic organisms from accidental over-sprays are reduced in shallow water bodies. We conclude that use of formulations of glyphosate under good agricultural practices presents a de minimis risk of direct and indirect adverse effects in non-target organisms."
nagycited64,Guy,NO,"Kalyabina, Valeriya P.; Esimbekova, Elena N.; Kopylova, Kseniya, V; Kratasyuk, Valentina A.","Pesticides: formulants, distribution pathways and effects on human health-a review",TOXICOLOGY REPORTS,8,1179,1192,10.1016/j.toxrep.2021.06.004,2021,"Pesticides are commonly used in agriculture to enhance crop production and control pests. Therefore, pesticide residues can persist in the environment and agricultural crops. Although modern formulations are relatively safe to non-target species, numerous theoretical and experimental data demonstrate that pesticide residues can produce long-term negative effects on the health of humans and animals and stability of ecosystems. Of particular interest are molecular mechanisms that mediate the start of a cascade of adverse effects. This is a review of the latest literature data on the effects and consequences of contamination of agricultural crops by pesticide residues. In addition, we address the issue of implicit risks associated with pesticide formulations. The effects of pesticides are considered in the context of the Adverse Outcome Pathway concept."
nagycited65,Guy,NO,"Abou Zeid, Mohamad, I; Jammoul, Adla M.; Melki, Khalil C.; Abou Jawdah, Yusuf; Awad, Mireille Kallassy",Suggested policy and legislation reforms to reduce deleterious effect of pesticides in Lebanon,HELIYON,6,NA,NA,10.1016/j.heliyon.2020.e05524,2020,"Countrywide pesticide management activities are resource draining, even for developed countries, which sometimes fall short in achieving the optimum protection against pesticides deleterious effects on humans and environment. Additionally, in Lebanon, basic flaws exist at different levels of pesticide management cycle. In this study, through an extensive review of relevant literature regarding the pesticides impact on humans and environment in Lebanon and adopted policies in existing legislation, several gaps have been identified. Accordingly, recommendations to reduce pesticide risk through a combination of reforms at the policy level and its tools, particularly legislation, are proposed. In our opinion, the starting point is to adopt a minimum list of lower risk pesticides supported by a combination of: prescriptions based on a comprehensive registration and an effective implementation systems, a suitable IPM/ICM government-supported credit system, traceability systems of agricultural commodities and pesticides containers, Pesticide stock management system to reduce the quantity of obsolete pesticides, and containers recycling system. For a global sustainability of pesticides risk reduction, a binding global intervention fostered by the UN, based on human rights for safe food, is called upon to ban hazardous pesticides-except those of WHO class IV- trafficking in developing countries scoring low in an international official assessment of their pesticides lifecycle management. At the same time, global funds should support pesticides alternatives and the enhancement of the developing countries capacities for pesticides lifecycle management, which is a part of a larger global matrix in risk reduction."
nagycited66,Guy,NO,"Demir, Esref",Drosophila as a model for assessing nanopesticide toxicity,NANOTOXICOLOGY,14,1271,1279,10.1080/17435390.2020.1815886,2020,"One of the fastest-moving fields in today's world of applied science, nanotechnology allows the control and design of matter on an extremely small scale, so it has now become an integral part of various industries and scientific areas, such as agriculture, food sector, healthcare and engineering. Understanding the interactions between nanopesticides and edible plants, as well as non-target animals, is crucial in assessing the potential impact of nanotechnology products on the environment, agriculture and human health. The dramatic increase in efforts to use nanopesticides renders the risk assessment of their toxicity and genotoxicity highly crucial due to the potential adverse impact of this relatively uncharted territory. Such widespread use naturally increases our exposure to nanopesticides, raising concerns over their possible adverse effects on humans and non-target organisms, which might include severe impairment of both male and female reproductive capacity. We therefore need better insight into such effects to derive conclusive evidence on the safety or toxicity/genotoxicity of nanopesticides, andDrosophila melanogaster(fruit fly) can prove an ideal model organism for the risk assessment and toxicological classification of nanopesticides, as it bears striking similarities to various systems in human body. This editorial review attempts to summarize our current knowledge derived from previousin vivostudies to examine the impact of several nanomaterials on various species of mammals and non-target model organisms at the genetic, cellular, and molecular levels, attracting attention to the possible mechanisms and potential toxic/genotoxic effects of nanopesticides widely used in agriculture onD. melanogasteras a non-target organism."
