STUDY_ID,REVIEWERS,INCLUDE,AUTHORS,TITLE,JOURNAL,ABSTRACT,YEAR,VOLUME,LPAGES,UPAGES,DOI
nagyrefs27,Guy,YES,"Hayes, TB; Case, P; Chui, S; Chung, D; Haeffele, C; Haston, K; Lee, M; Mai, VP; Marjuoa, Y; Parker, J; Tsui, M","Pesticide mixtures, endocrine disruption, and amphibian declines: Are we underestimating the impact?",ENVIRONMENTAL HEALTH PERSPECTIVES,"Amphibian populations are declining globally at an alarming rate. Pesticides are among a number of proposed causes for these declines. Although a sizable database examining effects of pesticides on amphibians exists, the vast majority of these studies focus on toxicological effects (lethality, external malformations, etc.) at relatively high doses (parts per million). Very few studies focus on effects such as endocrine disruption at low concentrations. Further, most studies examine exposures to single chemicals only. The present study examined nine pesticides (four herbicides, two fungicides, and three insecticides) used on cornfields in the midwestern United States. Effects of each pesticide alone (0.1 ppb) or in combination were examined. In addition, we also examined atrazine and S-metolachlor combined (0.1 or 10 ppb each) and the commercial formulation Bicep II Magnum, which contains both of these herbicides. These two pesticides were examined in combination because they are persistent throughout the year in the wild. We examined larval growth and development, sex differentiation, and immune function in leopard frogs (Rana pipiens). In a follow-up study, we also examined the effects of the nine-compound mixture on plasma corticosterone levels in male African clawed frogs (Xenopus laevis). Although some of the pesticides individually inhibited larval growth and development, the pesticide mixtures had much greater effects. Larval growth and development were retarded, but most significantly, pesticide mixtures negated or reversed the typically positive correlation between time to metamorphosis and size at metamorphosis observed in controls: exposed larvae that took longer to metamorphose were smaller than their counterparts that metamorphosed earlier. The nine-pesticide mixture also induced damage to the thymus, resulting in immunosuppression and contraction of flavobacterial meningitis. The study in X laevis revealed that these adverse effects may be due to an increase in plasma levels of the stress hormone corticosterone. Although it cannot be determined whether all the pesticides in the mixture contribute to these adverse effects or whether some pesticides are effectors, some are enhancers, and some are neutral, the present study revealed that estimating ecological risk and the impact of pesticides on amphibians using studies that examine only single pesticides at high concentrations may lead to gross underestimations of the role of pesticides in amphibian declines.",2006,114,40,50,10.1289/ehp.8051
nagyrefs28,Guy,YES,"Peixoto, F",Comparative effects of the Roundup and glyphosate on mitochondrial oxidative phosphorylation,CHEMOSPHERE,"The potential toxicity of the herbicide Roundup and its fundamental substance (glyphosate) was tested in bioenergetic functions of isolated rat liver mitocbondria. Roundup stimulates succinate-supported respiration twice, with simultaneous collapse of transmembrane electrical potential, while glyphosate used in the same concentrations does not induce any significant effect. Additionally, Roundup depresses state 3 respiration by about 40%, at 15 mM, whereas uncoupled respiration in the presence of FCCP is depressed by about 50%. Depression of uncoupled respiratory activity is mediated through partial inhibition of mitochondrial complexes II and III, but not of complex IV. The phosphorylative system was affected by both a direct and an indirect effect on the F0F1 ATPase activity. The addition of uncoupled concentrations of Roundup to Ca2+-loaded mitochondria treated with Ruthenium Red resulted in non-specific membrane permeabilization, as evidenced by mitochondrial swelling in isosmotic sucrose medium. Therefore, the uncoupling of oxidative phosphorylation is also related to the non-specific membrane permeabilization induced by Roundup. Glyphosate alone does not show any relevant effect on the mitochondrial bioenergetics, in opposition to Roundup formulation products. The differences in the toxicity observed could be either attributed to some products of Roundup or to a synergic effect of glyphosate and formulation products. Bearing in mind that mitochondria is provided with a variety of bioenergetic functions mandatory for the regulation of intracellular aerobic energy production and electrolyte homeostasis, these results question the safety of Roundup on animal health. (c) 2005 Elsevier Ltd. All rights reserved.",2005,61,1115,1122,10.1016/j.chemosphere.2005.03.044
nagyrefs29,Guy,YES,"Richard, S; Moslemi, S; Sipahutar, H; Benachour, N; Seralini, GE",Differential effects of glyphosate and roundup on human placental cells and aromatase,ENVIRONMENTAL HEALTH PERSPECTIVES,"Roundup is a glyphosate-based herbicide used worldwide, including on most genetically modified plants that have been designed to tolerate it. Its residues may thus enter the food chain, and glyphosate is found as a contaminant in rivers. Some agricultural workers using glyphosate have pregnancy problems, but its mechanism of action in mammals is questioned. Here we show that glyphosate is toxic to human placental JEG3 cells within 18 hr with concentrations lower than those found with agricultural use, and this effect increases with concentration and time or in the presence of Roundup adjuvants. Surprisingly, Roundup is always more toxic than its active ingredient. We tested the effects of glyphosate and Roundup at lower nontoxic concentrations on aromatase, the enzyme responsible for estrogen synthesis. The glyphosate-based herbicide disrupts aromatase activity and mRNA levels and interacts with the active site of the purified enzyme, but the effects of glyphosate are facilitated by the Roundup formulation in microsomes or in cell culture. We conclude that endocrine and toxic effects of Roundup, not just glyphosate, can be observed in mammals. We suggest that the presence of Roundup adjuvants enhances glyphosate bioavailability and/or bioaccumulation.",2005,113,716,720,10.1289/ehp.7728
nagyrefs30,Guy,YES,"Key, P; Delorenzo, M; Gross, K; Chung, K; Clum, A",Toxicity of the mosquito control pesticide Scourge((R)) to adult and larval grass shrimp (Palaemonetes pugio),JOURNAL OF ENVIRONMENTAL SCIENCE AND HEALTH PART B-PESTICIDES FOOD CONTAMINANTS AND AGRICULTURAL WASTES,"This study investigated the toxicity of various concentrations of technical resmethrinand Scourges on adult and larval Palaemonetes pugio, a common grass shrimp species. Two types of tests were conducted for each of the resmethrin formulations using adult and larval grass shrimp life stages, a 96-h static renewal aqueous test without sediment, and a 24-h static nonrenewal aqueous test with sediment. For resmethrin, the 96-h aqueous LC50 value for adult shrimp was 0.53 mu g/L (95% confidence interval (CI): 0.46-0.60 mu g/L), and for larval shrimp was 0.35 mu g/L (95% CI: 0.28-0.42 mu g/L). In the presence of sediment, technical resmethrin produced a 24-h LC50 value for adult shrimp of 5.44 mu g/L (95% CI: 4.52-6.55 mu g/L), and for larval shrimp of 2.15 mu g/L (95% CI: 1.35-3.43 mu g/L). For Scourge((R)), the 96-h aqueous LC50 for adult shrimp was 2.08 mg/L (95% CI: 1.70-2.54 mu g/L), and for larval shrimp was 0.36 mu g/L (95% CI: 0.24-0.55 mu g/L). The 24-h sediment test yielded an LC50 value of 16.12 mu g/L (95% CI: 14.79-17.57 mu g/L) for adult shrimp, and 14.16 mu g/L (95% CI: 12.21-16.43 mu g/L) for larvae. Adjusted LC50 values to reflect the 18% resmethrin concentration in Scourge((R)) are 0.37 mu g/L (adult), 0.07 mu g/L (larvae) for the 96-h aqueous test, and 2.90 mu g/L (adult), 2.6 mu g/L (larvae) for the 24-h sediment test. Larval grass shrimp were more sensitive to technical resmethrin and Scourges than the adult life stage. The results also demonstrate that synergized resmethrin is more toxic to P. pugio than the nonsynergized form, and that the presence of sediment decreases the toxicity of both resmethrin and Scourges.",2005,40,585,594,10.1081/PFC-200061552
nagyrefs31,Guy,NO,"Goktepe, I; Plhak, LC",Acute toxicity assessment of azadirachtin-based pesticides using murine hybridoma and oyster cells,JOURNAL OF ENVIRONMENTAL SCIENCE AND HEALTH PART B-PESTICIDES FOOD CONTAMINANTS AND AGRICULTURAL WASTES,"In vitro acute toxicities of azadirachtin-containing pesticides (Neemix(TM) and Bioneem(TM)), formulated with neem tree extracts, and pure azadirachtin (AZA), the believed active ingredient, were studied using hybridoma and oyster cells and were compared to results obtained using the standard in vivo Daphnia pulex toxicity assay. Neem-based pesticides showed relatively high toxicity to both hybridoma and oyster cells at concentrations of 1 mug AZA/mL and higher. The IC50 values for hybridoma cells were 2.15 mug AZA/mL for Neemix(TM) and 1.67 mug AZA/mL for Bioneem(TM). Oyster cells had IC50 values of 2.18 mug AZA/mL for Neemix(TM) and 9.46 mug AZA/mL for Bioneem(TM). Purified AZA, however, did not appear to be as toxic as the formulations. D. pulex was also more sensitive to neem-based pesticide exposure than that of pure AZA. The applications and limits of these two in vitro models for testing the acute toxicity of AZA-based pesticides are discussed in comparison with the in vivo D.pulex test.",2003,38,169,180,10.1081/PFC-120018447
nagyrefs32,Guy,YES,"Holland, NT; Duramad, P; Rothman, N; Figgs, LW; Blair, A; Hubbard, A; Smith, MT","Micronucleus frequency and proliferation in human lymphocytes after exposure to herbicide 2,4-dichlorophenoxyacetic acid in vitro and in vivo",MUTATION RESEARCH-GENETIC TOXICOLOGY AND ENVIRONMENTAL MUTAGENESIS,"Widespread use of the herbicide 2,4-dichlorophenoxyacetic acid (2,4-D) and its association with non-Hodgkin's lymphoma (NHL) and other cancers has raised public concern. Here, micronucleus (MN) formation has been used as a biomarker of genotoxicity, and replicative and mitotic indices (MIs) as biomarkers of cell cycle kinetics in human lymphocytes. Cells were cultured either as whole blood or isolated lymphocytes and treated with pure or commercial forms of 2,4-D at doses between 0.001 and 1 mM for 48 h. Exposure to 2,4-D produced a minimal increase in MN in whole blood and even smaller one in isolated lymphocyte cultures. This induction took place only at levels approaching cytotoxicity and was accompanied by a significant inhibition of replicative index (RI). At a low (0.005 mM) dose of commercial 2,4-D, a small, marginally significant increase in RI (12-15%) was found in two independent sets of experiments (P = 0.052). Additionally, we found that lymphocyte RI was more affected by commercial 2,4-D containing 9.4% of the chemically pure 2,4-D, than with an equal concentration of the latter suggesting that other ingredients present in the commercial pesticide may be responsible or may enhance the effect of 2,4-D. Mitotic index, however, did not show any significant change with either commercial or pure 2,4-D. The lymphocytes of 12 male applicators exposed solely to 2,4-D during a 3-month period had a significantly higher RI than the same group prior to exposure and than a control group (P < 0.01), in accordance with the in vitro finding of increased RI at low doses. (C) 2002 Elsevier Science B.V. All rights reserved.",2002,521,165,178,10.1016/S1383-5718(02)00237-1
nagyrefs33,Guy,YES,"Soloneski, S; Gonzalez, M; Piaggio, E; Reigosa, MA; Larramendy, ML","Effect of dithiocarbamate pesticide zineb and its commercial formulation, azzurro III. Genotoxic evaluation on Chinese hamster ovary (CHO) cells",MUTATION RESEARCH-GENETIC TOXICOLOGY AND ENVIRONMENTAL MUTAGENESIS,"The in vitro genotoxicity exerted by the dithiocarbamate fungicide zineb, and its commercial formulation azzurro, were studied in Chinese hamster ovary (CHO) cells by the analysis of the sister chromatid exchange (SCE), cell-cycle progression and single cell gel electrophoresis (SCGE) assays. Both zineb and azzurro activities were tested within the range of 0.1-100.0 mug/ml. Concentrations of 0.1-25.0 mug/ml of zineb or azzurro, induced a significant dose-dependent increase in SCE frequency over control values. For both test compounds, while doses ranging from 0.1 to 1.0 mug/ml did not alter the rate of cell proliferation, a significant delay in cell-cycle progression was observed within the 5.0-25.0 mug/ml dose-range. A regression test showed that either the proliferative replication index or the mitotic activity of cultures decreased as a function of the pesticide concentration within the 1.0-25.0 mug/ml dose-range. Doses higher than 50.0 mug/ml were cytotoxic. SCGE assay revealed an increase in zineb-induced DNA damage by enhancing the proportion of slightly damaged cells in the 25.0-100.0 mug/ml dose-range and by increasing in a dose-dependent manner the proportion of damaged cells within the 1.0-100.0 mug/ml dose-range. Overall, image analysis showed statistically significant positive relationships between zincb concentration and DNA damage (expressed by image length and width) and between length and width of the damaged cells. In azzurro-treated cells, only when 100.00 mug/ml was employed a significant increase in the frequency of damaged cells over control values affecting the totality of the cells was observed only when 100.0 mug/ml was employed. When lower doses were employed, no DNA damage was revealed. Based on these results, the evaluation of zineb as a genotoxic/non-genotoxic compound for human health should be reconsidered. Even though we demonstrate that the pesticide induces large DNA alterations in vitro, does no necessarily mean that the chemical should be considered clastogenic. (C) 2002 Elsevier Science B.V. All rights reserved.",2002,514,201,212,10.1016/S1383-5718(01)00337-0
nagyrefs34,Guy,YES,"Soloneski, S; Gonzalez, M; Piaggio, E; Apezteguia, M; Reigosa, MA; Larramendy, ML",Effect of the dithiocarbamate pesticide zineb and its commercial formulation azzurro. I. Genotoxic evaluation on cultured human lymphocytes exposed in vitro,MUTAGENESIS,"The in vitro cytogenetic effects exerted by the dithiocarbamate fungicide zineb and one of its commercial formulations currently used in Argentina, azzurro, were studied in whole blood human lymphocyte cultures. The genotoxicity of the fungicides was measured by analysis of the frequency of chromosomal aberrations and sister chromatid exchanges (SCEs) and cell cycle progression assays. Both zineb and azzurro activities were tested within the range 0.1-100.0 mug/ml immediately after in vitro lymphocyte stimulation. Only concentrations of 50.0 and 100.0 mug/ml zineb and azzurro induced a significant increase in SCE frequency over control values. Furthermore, this genotoxicity appears to be correlated with its cytotoxicity, measured as cell cycle kinetics, since both a significant delay in cell cycle progression and a significant reduction in proliferative rate index were only observed in those cultures treated with these fungicide concentrations. For both chemicals, a progressive dose-related inhibition of the mitotic activity of cultures was observed when increasing the fungicide concentration. Moreover, only the mitotic activity statistically differed from control values when doses of zineb or azzurro <10 <mu>g/ml were employed. For both fungicides the mitotic index reached the minimal value at doses of 100 mug/ml. Both products induced a significant dose-dependent increase in the number of abnormal cells, chromatid-type and chromosome-type aberrations as well as in the total number of aberrations in the 0.1-100.0 mug/ml dose range. Based on these results, the evaluation of zineb as a controversial genotoxic/non-genotoxic compound for human health should be reconsidered. Instead, we demonstrate that the fungicide induces large DNA alterations and should be considered as a clastogenic mutagen.",2001,16,487,493,10.1093/mutage/16.6.487
nagyrefs35,Guy,YES,"Nebeker, AV; Schuytema, GS; Griffis, WL; Cataldo, A",Impact of Guthion on survival and growth of the frog Pseudacris regilla and the salamanders Ambystoma gracile and Ambystoma maculatum,ARCHIVES OF ENVIRONMENTAL CONTAMINATION AND TOXICOLOGY,"The effects of the insecticides Guthion (technical grade) and Guthion 2S (commercial formulation) on survival and growth of tadpoles of the Pacific treefrog Pseudacris regilla, and larvae of the Northwestern salamander Ambystoma gracile and the spotted salamander Ambystoma maculatum were determined in continuous-flow exposures in the laboratory. Ninety-six-hour LC50 values were >3.6 mg/L for P. regilla with technical grade Guthion and 1.47 mg/L with the formulation Guthion 2S (measured as active ingredient Guthion). Ten-day LOAEL and NOAEL values based on length and weight for P. regilla with Guthion were 3.60 and 0.98 mg/L. LOAEL and NOAEL values based on length and weight for P. regilla with Guthion 2S were 0.17 and 0.07 mg/L. The 96-h LC50 for Guthion 2S was 1.67 and 1.90 mg/L for A. gracile and A. maculatum, respectively. LOAEL and NOAEL values based on length and weight for A. gracile with Guthion 2S were 0.22 and 0.10 mg/L; they were 0.11 and 0.03 mg/L for A. maculatum based on weight. These species are as similar in sensitivity as some fish species but are more tolerant to Guthion than most invertebrates.",1998,35,48,51,10.1007/s002449900347
nagyrefs36,Guy,YES,"Moretti, M; Villarini, M; ScassellatiSforzolini, G; Pasquini, R; Monarca, S",Applicability of aspecific noninvasive methods for biomonitoring of occupational exposure to deltamethrin: Preliminary study using an animal model,ARCHIVES OF ENVIRONMENTAL CONTAMINATION AND TOXICOLOGY,"Deltamethrin (CAS registry No. 52918-63-5), a synthetic dibromo-pyrethroid insecticide is highly effective against a broad spectrum of insects, and is widely used on crops and in public health programs. Data on the genotoxicity and carcinogenicity of deltamethrin are rather controversial, depending on the genetic system or the assay used. The aim of the present study was to analyze previously demonstrated metabolic changes using aspecific noninvasive methods in rats which art: potentially applicable for monitoring occupational exposure. Since human exposure to pesticides occurs not only to active principles but to ail chemicals present in a commercial formulation, we tested both the pure compound and a deltamethrin-based commercial formulation. Groups of rats were treated, i.p., consecutively for 7 days. The daily doses tested were 5 and 10 mg/kg body weight for pure deltamethrin, corresponding to volumes of 178.57 and 377.14 mu l/kg body weight for the commercial formulation (containing 2.8% deltamethrin). Urine was analyzed for mutagenic metabolites, thioethers, and D-glucaric acid content. Faeces extracts were tested for mutagenicity. Results show that DGA urinary excretion values did not mirror the phase I enzyme induction capability of the insecticide. Results obtained for urinary thioethers do not agree completely with those obtained on the influence of deltamethrin on glutathione S-transferase activity in rat liver. In fact, after administration of the deltamethrin commercial formulation, highest thioether excretion values were obtained during the treatment time for treated animals, as compared to controls. The mean values (+/-SEM) of thioether excretion were 0.033 +/- 0.002 mu mole -SH/24 h for control animals, 0.122 +/- 0.004 and 0.185 +/- 0.025 for the two treatment groups. Thence, thioether determination in urine samples seems to be a suitable aspecific noninvasive method for assessing exposure to deltamethrin-based formulations, particularly those containing xylene and mesitylene as solvents, as in the tested formulation. Negative or toxic results obtained in the urinary and faecal mutagenicity test seem to exclude the formation and excretion of mutagenic metabolites following treatment with deltamethrin.",1997,33,323,328,10.1007/s002449900260
nagyrefs37,Guy,NO,"Klimisch, HJ; Andreae, M; Tillmann, U",A systematic approach for evaluating the quality of experimental toxicological and ecotoxicological data,REGULATORY TOXICOLOGY AND PHARMACOLOGY,"The evaluation of the quality of data and their use in hazard and risk assessment as a systematic approach is described. Definitions are proposed for reliability, relevance, and adequancy of data. Reliability is differentiated into four categories. Criteria relating to international testing standards for categorizing reliability are developed. A systematic documentation of evaluating reliability especially for use in the IUCLID database is proposed. This approach is intended to harmonize data evaluation processes worldwide. It may help the expert in subsequent assessments and should increase the clarity of evaluation. (C) 1997 Academic Press.",1997,25,1,5,10.1006/rtph.1996.1076
nagyrefs38,Guy,NO,"CSERHATI, T",ALKYL ETHOXYLATED AND ALKYLPHENOL ETHOXYLATED NONIONIC SURFACTANTS - INTERACTION WITH BIOACTIVE COMPOUNDS AND BIOLOGICAL EFFECTS,ENVIRONMENTAL HEALTH PERSPECTIVES,"This review deals with recent advances in the study of interactions of nonionic surfactants with proteins, peptides, amino acids, membrane phospholipids, and organisms. The effect of surfactants on the structure and biological activity of the interacting biomolecules and organisms is discussed, with emphasis on the impact of hydrophobic and hydrophilic molecular substructures on biological efficiency.",1995,103,358,364,10.2307/3432289
nagyrefs39,Guy,YES,"COSENZA, ME; BIDANSET, J",EFFECTS OF CHLORPYRIFOS ON NEURONAL DEVELOPMENT IN RAT EMBRYO MIDBRAIN MICROMASS CULTURES,VETERINARY AND HUMAN TOXICOLOGY,"Chorpyrifos (CPF) Is a broad-spectrum organophosphate insecticide used to control mosquitos and household insects. In man it has toxic effects on the central nervous system, the cardiovascular system and the respiratory system. This study investigated the toxicity of CPF on nervous system development using the midbrain micromass culture system. Chlorpyrifos was tested as a marketed formulation and in 3 solvents. All demonstrated toxicity in midbrain micromass cells with IC50 values below 30 ug/mL, indicating a potent teratogen.",1995,37,118,121,
nagyrefs40,Guy,YES,"FLAHERTY, DK; WINZENBURGER, PA; GROSS, CJ; MCGARITY, KL; PANYIK, M; FENG, P",THE EFFECT OF LASSO(R) HERBICIDE ON HUMAN IMMUNE FUNCTION AS MEASURED BY INVITRO ASSAYS,IMMUNOPHARMACOLOGY AND IMMUNOTOXICOLOGY,"Using in vitro assays, this study was undertaken to determine whether the components of Lasso(R) herbicide formulation had an effect on the human immune system. Mononuclear cells from human peripheral blood were exposed to analytical alachlor, alachlor conjugated to human serum albumin or Lasso formulation over a concentration range from .01 uM-1.0 uM. The effects of the test materials on the following immunological functions were determined: lymphocyte proliferation induced by mitogen or antigen; antibody synthesis of IgG and IgM isotypes in pokeweed stimulated monouclear cell cultures; cytotoxic T cell proliferation; lysis of target cells by natural killer cells and lymphokine activated killer cells. The data demonstrated that the test compounds had no significant, dose related effect on the function of immunocompetent cells. Hence, the data suggest that the components of the Lasso formulation have no effect on the human immune system.",1992,14,955,979,10.3109/08923979209009244
nagyrefs41,Guy,YES,"MUSTONEN, R; KANGAS, J; VUOJOLAHTI, P; LINNAINMAA, K",EFFECTS OF PHENOXYACETIC ACIDS ON THE INDUCTION OF CHROMOSOME-ABERRATIONS INVITRO AND INVIVO,MUTAGENESIS,,1986,1,241,245,10.1093/mutage/1.4.241
nagyrefs42,Guy,YES,"LECHNER, DMW; ABDELRAHMAN, MS",A TERATOLOGY STUDY OF CARBARYL AND MALATHION MIXTURES IN RAT,JOURNAL OF TOXICOLOGY AND ENVIRONMENTAL HEALTH,,1984,14,267,278,
,,,,,,,,,,,
,,33,,,,,,,,,