AUTHORS,TITLE,YEAR,JOURNAL,VOLUME,LPAGES,UPAGES,DOI,ABSTRACT
Le Cor F.; Slaby S.; Dufour V.; Iuretig A.; Feidt C.; Dauchy X.; Banas D.,Occurrence of pesticides and their transformation products in headwater streams: Contamination status and effect of ponds on contaminant concentrations,2021,Science of the Total Environment,788,,,10.1016/j.scitotenv.2021.147715,"In France, more than 90% of monitored watercourses are contaminated with pesticides. This high contamination level increases at the head of agricultural watersheds, where dilution capacities are low and transport from treated lands is direct. Ponds, numerous around headwater streams, could provide additional protection against pesticide pollution. Because of their long hydraulic residence time and large water volumes, they mitigate pesticide concentrations between upstream and downstream rivers. However, pesticide transformation products may also be responsible for the degradation of environments, owing to their presence at high concentrations and their persistence, but related data are scarce, particularly because of their high level of molecular diversity. We first reported on the state of water contamination in agricultural headwater streams, based on high frequency water sampling. Analysis of 67 molecules (HPLC-ESI-MS/MS) showed pesticides and pesticide transformation product mixtures of up to 29 different compounds in one sample. Regardless of the sampling location, transformation products represented at least 50% of the detected compounds. Then, we demonstrated the capacity of a pond to reduce contaminant concentrations in downstream rivers for 90% of the detected compounds. Upstream from this pond, environmental quality or ecotoxicological standards were exceeded during sampling, with pesticide and transformation product sum concentrations of up to 27 μg/L. Downstream from the study pond, few exceedances were observed, with a maximum total concentration of 2.2 μg/L, reflecting significant water quality improvement. © 2021 Elsevier B.V."
Tariba Lovaković B.; Kašuba V.; Katić A.; Kopjar N.; Marjanović Čermak A.M.; Micek V.; Milić M.; Pavičić I.; Pizent A.; Žunec S.; Želježić D.,Evaluation of oxidative stress responses and primary DNA damage in blood and brain of rats exposed to low levels of tembotrione,2020,Chemosphere,253,,,10.1016/j.chemosphere.2020.126643,"Tembotrione is a rather novel pesticide, usually used for post-emergence weed control. Even though its use is rapidly growing, it is not followed by an adequate flow of scientific evidence regarding its toxicity towards non-target organisms. We evaluated the potential of low doses of tembotrione to induce oxidative stress and cytogenetic damage in blood and brain cells of adult male Wistar rats. Parameters of lipid peroxidation, glutathione levels, activities of antioxidant enzymes and primary DNA damage were assessed following 28-day repeated oral exposure to doses comparable with the currently proposed health-based reference values. The results of the alkaline comet assay showed that such low doses of tembotrione have the potency to inflict primary DNA damage in both peripheral blood leukocytes and brain of treated rats, even with only slight changes in the oxidative biomarker levels. The DNA damage in blood and brain cells of Wistar rats significantly increased at all applied doses, suggesting that tembotrione genotoxicity is mainly a result of direct interaction with DNA while the induction of oxidative stress responses contributes to DNA instability in a lesser extent. The findings of the present study call for further research using other sensitive biomarkers of effect and different exposure scenarios. © 2020 Elsevier Ltd"
Jablonski C.A.; Pereira T.C.B.; Teodoro L.D.S.; Altenhofen S.; Rübensam G.; Bonan C.D.; Bogo M.R.,Acute toxicity of methomyl commercial formulation induces morphological and behavioral changes in larval zebrafish (Danio rerio),2022,Neurotoxicology and Teratology,89,,,10.1016/j.ntt.2021.107058,"The use of pesticides has continue grown over recent years, leading to several environmental and health concerns, such as the contamination of surface and groundwater resources and associated biota, potentially affecting populations that are not primary targets of these complex chemical mixtures. In this work, we investigate lethal and sublethal effects of acute exposure of methomyl commercial formulation in zebrafish embryo and larvae. Methomyl is a broad-spectrum carbamate insecticide and acaricide that acts primarily in acetylcholinesterase inhibition (AChE). Methomyl formulation 96 h-LC50 was determined through the Fish Embryo Acute Toxicity Test (FET) and resulted in 1.2 g/L ± 0.04. Sublethal 6-day exposure was performed in six methomyl formulation concentrations (0.5; 1.0; 2.2; 4.8; 10.6; 23.3 mg/L) to evaluate developmental, physiological, morphological, behavioral, biochemical, and molecular endpoints of zebrafish early-development. Methomyl affected embryo hatching and larva morphology and behavior, especially in higher concentrations; resulting in smaller body and eyes size, failure in swimming bladder inflation, hypolocomotor activity, and concentration-dependent reduction of AChE activity; demonstrating methomyl strong acute toxicity and neurotoxic effect. © 2021"
Tefera Y.M.; Gaskin S.; Thredgold L.; Pisaniello D.,The role of formulation co-ingredients in skin and glove barrier protection against organophosphate insecticides,2022,Pest Management Science,78,177,183,10.1002/ps.6621,"BACKGROUND: Commercially formulated pesticide products are complex mixtures of one or more active ingredients and several co-ingredients. However, the modifying effect of co-ingredients on skin uptake and glove barrier protection has been poorly studied. The aim of this study was to understand the role of formulation co-ingredients in skin and glove barrier protection performance against organophosphate insecticides. RESULTS: We adapted standard in vitro diffusion cell methods to test permeation kinetics of two commonly used organophosphate insecticides: dimethoate and omethoate. For spray dilutions, dimethoate and omethoate did not reach breakthrough glove permeation rate (1 μg·cm−2·min−1) and no or little skin permeation was observed for up to 8 h, regardless of formulation. For exposure conditions involving highly concentrated products, significant differences in glove permeation were observed between different formulations of dimethoate (about 1.5-fold, P < 0.05) and of omethoate (184-fold, P < 0.001). In contrast, no difference (P > 0.05) was observed between formulations in terms of skin permeation. CONCLUSION: These results suggest that co-ingredients play a critical role in glove barrier protection against undiluted organophosphate insecticides, whereas their influence on skin uptake was insignificant within the exposure time tested. This implies that dermal exposure risk may vary between handling different formulated products of the same active ingredient hence recommending a common glove material for different formulations of the same chemical without careful consideration of co-ingredients and their permeation properties may not necessarily be appropriate. © 2021 Society of Chemical Industry. © 2021 Society of Chemical Industry."
Truzzi F.; Mandrioli D.; Gnudi F.; Scheepers P.T.J.; Silbergeld E.K.; Belpoggi F.; Dinelli G.,Comparative Evaluation of the Cytotoxicity of Glyphosate-Based Herbicides and Glycine in L929 and Caco2 Cells,2021,Frontiers in Public Health,9,,,10.3389/fpubh.2021.643898,"Introduction: Glyphosate, an amino acid analog of glycine, is the most widely applied organophosphate pesticide worldwide and it is an active ingredient of all glyphosate-based herbicides (GBHs), including the formulation “Roundup. ” While glycine is an essential amino acid generally recognized safe, both epidemiological and toxicological in vivo and in vitro studies available in literature report conflicting findings on the toxicity of GBHs. In our earlier in vivo studies in Sprague–Dawley rats we observed that exposure to GBHs at doses of glyphosate of 1.75 mg/kg bw/day, induced different toxic effects relating to sexual development, endocrine system, and the alteration of the intestinal microbiome. In the present work, we aimed to comparatively test in in vitro models the cytotoxicity of glycine and GBHs. Methods: We tested the cytotoxic effects of glycine, glyphosate, and its formulation Roundup Bioflow at different doses using MTT and Trypan Blue assays in human Caco2 and murine L929 cell lines. Results: Statistically significant dose-related cytotoxic effects were observed in MTT and Trypan Blue assays in murine (L929) and human (Caco2) cells treated with glyphosate or Roundup Bioflow. No cytotoxic effects were observed for glycine. In L929, Roundup Bioflow treatment showed a mean IC50 value that was significantly lower than glyphosate in both MTT and Trypan Blue assays. In Caco2, Roundup Bioflow treatment showed a mean IC50 value that was significantly lower than glyphosate in the MTT assays, while a comparable IC50 was observed for glyphosate and Roundup Bioflow in Trypan Blue assays. IC50 for glycine could not be estimated because of the lack of cytotoxic effects of the substance. Conclusion: Glyphosate and its formulation Roundup Bioflow, but not glycine, caused dose-related cytotoxic effects in in vitro human and murine models (Caco2 and L929). Our results showed that glycine and its analog glyphosate presented different cytotoxicity profiles. Glyphosate and Roundup Bioflow demonstrate cytotoxicity similar to other organophosphate pesticides (malathion, diazinon, and chlorpyriphos). © Copyright © 2021 Truzzi, Mandrioli, Gnudi, Scheepers, Silbergeld, Belpoggi and Dinelli."
Pinto T.J.D.S.; Moreira R.A.; Silva L.C.M.D.; Yoshii M.P.C.; Goulart B.V.; Fraga P.D.; Montagner C.C.; Daam M.A.; Espindola E.L.G.,"Impact of 2,4-D and fipronil on the tropical midge Chironomus sancticaroli (Diptera: Chironomidae)",2021,Ecotoxicology and Environmental Safety,209,,,10.1016/j.ecoenv.2020.111778,"Increased use of pesticides in conventional agriculture implies potential risks to the environment. In aquatic ecosystems, benthic organisms may be exposed to pesticides via contaminated water and sediment, leading to several potential cascading effects on the food web. The aim of this study was to assess the functional implications of environmental realistic concentrations of the herbicide 2,4-D and the insecticide fipronil (alone and in combination) to the native tropical chironomid Chironomus sancticaroli. These two pesticides are widely applied to different crops and have frequently been detected (together) in surface water bodies in Brazil and elsewhere. Commercial products containing fipronil (Regent® 800WG) and 2,4-D (DMA® 806BR) were evaluated in 8-day toxicity tests for their effects on larval survival, growth (body length and biomass), head capsule width, development, and mentum deformities. Fipronil decreased the larval survival at the highest test concentration and the effective concentrations (EC) after eight days of exposure were: EC10 = 0.48 µg L−1 (0.395–0.565), EC20 = 1.06 µg L−1 (0.607–1.513), and EC50 = 3.70 µg L−1 (1.664–5.736). All sublethal test concentrations of fipronil decreased the larval growth, causing reductions in biomass up to 72%. The two highest test concentrations of fipronil decreased the head capsule width and after exposure to 3.7 µg fipronil L−1, only half of the larvae reached the fourth instar. The incidence of deformities was increased by fipronil in a concentration dependent manner with an increase ranging from 23% to 75%. The highest test concentration of 2.4-D (426 µg L−1) decreased the head capsule width, but larval development was unaffected at all concentrations evaluated. In the mixture tests, antagonism was observed at lower fipronil concentrations and synergism at higher fipronil concentrations for growth. The incidence of deformities rose with increasing fipronil concentrations. The results showed that environmental realistic concentrations of fipronil may have serious ecological implications for C. sancticaroli populations and that a mixture with the herbicide 2,4-D can have synergistic effects, potentiating the risks to the aquatic ecosystem. © 2020 The Authors"
Rohlman D.S.; Olson J.R.; Ismail A.A.; Bonner M.R.; Abdel Rasoul G.; Hendy O.,Identifying and preventing the neurotoxic effects of pesticides,2022,Advances in Neurotoxicology,7,203,255,10.1016/bs.ant.2022.05.001,"Pesticides are important tools for our food system and for public health. Designed to control pests, they can also adversely impact human health and the environment. Pesticide use has evolved over time due to environmental contamination, pest resistance, or concerns about human or animal health effects. The goal is to find the safest pesticide for humans, animals, and the environment that effectively controls the pest. This chapter presents background information on the types of pesticides, their toxicity, and mechanisms of action. It also provides an overview of how pesticides are used in agriculture, the pathways of exposure, and methods to control pesticide exposure. A case study describing adolescent pesticide exposure in Egypt is presented to demonstrate factors to consider when designing a research study or an intervention to reduce exposure. Understanding these factors are critical to understand how to prevent exposure to pesticides and the subsequent neurotoxic effects. © 2022 Elsevier Inc."
Straw E.A.; Brown M.J.F.,"No evidence of effects or interaction between the widely used herbicide, glyphosate, and a common parasite in bumble bees",2021,PeerJ,9,,,10.7717/peerj.12486,"Background. Glyphosate is the world’s most used pesticide and it is used without the mitigation measures that could reduce the exposure of pollinators to it. However, studies are starting to suggest negative impacts of this pesticide on bees, an essential group of pollinators. Accordingly, whether glyphosate, alone or alongside other stressors, is detrimental to bee health is a vital question. Bees are suffering declines across the globe, and pesticides, including glyphosate, have been suggested as being factors in these declines. Methods. Here we test, across a range of experimental paradigms, whether glyphosate impacts a wild bumble bee species, Bombus terrestris. In addition, we build upon existing work with honey bees testing glyphosate-parasite interactions by conducting fully crossed experiments with glyphosate and a common bumble bee trypanosome gut parasite, Crithidia bombi. We utilised regulatory acute toxicity testing protocols, modified to allow for exposure to multiple stressors. These protocols are expanded upon to test for effects on long term survival (20 days). Microcolony testing, using unmated workers, was employed to measure the impacts of either stressor on a proxy of reproductive success. This microcolony testing was conducted with both acute and chronic exposure to cover a range of exposure scenarios. Results. We found no effects of acute or chronic exposure to glyphosate, over a range of timespans post-exposure, on mortality or a range of sublethal metrics. We also found no interaction between glyphosate and Crithidia bombi in any metric, although there was conflicting evidence of increased parasite intensity after an acute exposure to glyphosate. In contrast to published literature, we found no direct impacts of this parasite on bee health. Our testing focussed on mortality and worker reproduction, so impacts of either or both of these stressors on other sublethal metrics could still exist. Conclusions. Our results expand the current knowledge on glyphosate by testing a previously untested species, Bombus terrestris, using acute exposure, and by incorporating a parasite never before tested alongside glyphosate. In conclusion our results find that glyphosate, as an active ingredient, is unlikely to be harmful to bumble bees either alone, or alongside Crithidia bombi. Copyright 2021 Straw and Brown"
Hendlin Y.H.; Arcuri A.; Lepenies R.; Hüesker F.,Like oil and water: The politics of (not) assessing glyphosate concentrations in aquatic ecosystems,2020,European Journal of Risk Regulation,11,539,564,10.1017/err.2020.65,"Since the International Agency on Cancer Research's monograph found glyphosate to be a likely carcinogen, the regulatory focus on the chemical has centred on this determinative criterion for regulatory action. Yet, other pertinent factors, such as the effects of glyphosate on fresh and ground water and ensuing effects on biodiversity, have received less attention as legitimate rationales for regulating the chemical. This underrepresentation prevents a wider policy discussion on the environmental and human health effects of the chemical and fails to disrupt assumptions of path-dependently continuing on agriculture's chemical treadmill. To avoid ad hoc post hoc chemical regulation, we assess four areas of chemical regulatory oversight in Europe with regard to glyphosate affecting water: (1) the undue emphasis on in laboratorio versus in situ testing; (2) assessing single chemicals (isolated glyphosate) versus admixtures (glyphosate plus surfactants and adjuvants) that are used in practice; (3) the tendency to downplay harms to nonhuman life; and (4) the lack of policy coherence in the existing regulatory framework. Focusing on European Union regulation of pesticide and water policy affecting aquatic environments, we conclude that issues of measurement and priority have become highly politicised in both science and policy, requiring preventative, precautionary frameworks utilising plural forms of measurement.  © The Author(s), 2020."
Maddalon A.; Galbiati V.; Colosio C.; Mandić-Rajčević S.; Corsini E.,Glyphosate-based herbicides: Evidence of immune-endocrine alteration,2021,Toxicology,459,,,10.1016/j.tox.2021.152851,"Glyphosate (G) is the active ingredient of the most widely used herbicide products. It targets the enzyme 5-enolpyruvylshikimate-3-phosphate synthase (EPSPS), which lacks in humans, suggesting to confer a low mammalian toxicity to G-based herbicides (GBHs). Despite this, the use of G is currently under intense debate. Many studies indicating its hazard and toxicity on non-target organisms are emerging, and associations between GBHs and immune-endocrine disturbances have been described. This review aims to investigate, based on recent epidemiological studies and studies performed in vitro and in vivo in animals, the possible association between GBHs and immune-endocrine alterations. Published data suggest that GBHs have endocrine disrupting potentiality targeting sex and thyroid hormones, although its relevance for humans will require further investigations. Evidence of immunotoxicity are limited compared to those on endocrine effects, but overall highlight possible noxious effects, including lung inflammation and rhinitis. An attractive hypothesis could be the one that connects microbiota dysbiosis with possible immune-endocrine outcomes. Indeed, several intestinal microorganisms express the enzyme EPSPS and, studies are emerging that highlight a possible G-induced dysbiosis. Considering the wide use of GBHs in agriculture, further studies investigating their noxious effects at levels relevant for human exposure should be performed. A critical analysis of emerging evidence of G toxicity is required to better characterize its safety profile. In addition, attention should be paid to the differences between G alone and its formulations, which, containing substances able to increase G absorption, may present a different toxicity profile. © 2021 Elsevier B.V."
Almroth B.C.; Athey S.,Toxic chemicals in textiles and the role of microplastic fibres as a source and vector for chemicals to the environment,2022,Polluting Textiles: The Problem with Microfibres,,100,132,10.4324/9781003165385-6,[No abstract available]
Maldonado-Reina A.J.; López-Ruiz R.; Romero-González R.; Martínez Vidal J.L.; Garrido-Frenich A.,Assessment of Co-Formulants in Marketed Plant Protection Products by LC-Q-Orbitrap-MS: Application of a Hybrid Data Treatment Strategy Combining Suspect Screening and Unknown Analysis,2022,Journal of Agricultural and Food Chemistry,70,7302,7313,10.1021/acs.jafc.2c01152,"The aim of this study was the determination of co-formulants in 15 different chlorantraniliprole- and difenoconazole-based plant protection products (PPPs) belonging to different formulations. Samples were analyzed by ultrahigh-performance liquid chromatography coupled to Q-Orbitrap high-resolution mass accuracy spectrometry (UHPLC-Q-Orbitrap-MS), operating in full-scan MS and data-dependent acquisition (ddMS2) modes. A total of 78 co-formulants were tentatively identified by a combination of suspect screening and unknown analysis. Nine of them were later confirmed by analytical standards. Finally, the analytical method was successfully validated and co-formulants were quantified. Linear alkyl ethoxylates (LAS) were the most common type of co-formulant, followed by sodium alkylbenzene sulfonates. Moreover, sodium dodecyl benzene sulfonate had the highest concentration of any co-formulant (up to 32.33 g/L). In all, an innovative identification of co-formulants in a large number of PPPs is presented, which will give room for future studies delving into the composition of PPPs or determining these co-formulants in environmental or agricultural samples. © 2022 American Chemical Society. All rights reserved."
Berlitz D.L.; Fiuza L.M.; Polanczyk R.A.; Ardisson-Araújo D.M.P.; Cassal M.C.; Capalbo D.M.F.,Biopesticides in sustainable agriculture: Current status and prospects,2021,"Bacillus thuringiensis: Cultivation, Applications in Agriculture and Environmental Safety",,1,43,,"Sustainable agriculture is on the rise in different countries of the world. On the other hand, there is an increase in the demand for food and the production of different cultures, which requires the reduction of agents that impact the environment, such as chemical inputs. This chapter will introduce biopesticides in this challenging scenario: the ones available, their market, and their interaction with chemical pesticides (as coexistence is demanded in the transition for a better production system). Furthermore, an overview will discuss the future research in prospecting for bioproducts, their production issues and potential market as effective protagonists of a sustainable agriculture in Brazil and in the world. © 2021 Nova Science Publishers, Inc."
Poliserpi M.B.; Cristos D.S.; Brodeur J.C.,Imidacloprid seed coating poses a risk of acute toxicity to small farmland birds: A weight-of-evidence analysis using data from the grayish baywing Agelaioides badius,2021,Science of the Total Environment,763,,,10.1016/j.scitotenv.2020.142957,"The aim of this study was to estimate the risk posed by imidacloprid (IMI) seed coating to passerine birds of the Pampa Region of Argentina using data specifically generated with the grayish baywing (Agelaioides badius). Median lethal dose (LD50) of the IMI-based formulation tested was 57.11 mg IMI/kg body weight (bw), with intoxication signs starting from 20.6 mg IMI/kg bw. The feed intake rate (FIR) was estimated experimentally as 4.895 g/day per bird, representing 12.43% of bw. It was calculated that the ingestion of 7–10% of the FIR as treated seeds would be enough to achieve the LD50 for sorghum, corn, sunflower, and alfalfa, whereas consumption of 31 and 54% of FIR was necessary for oat and wheat, respectively. Based on spill data values available in the literature, it was calculated that, for most crops, a baywing would have to forage an area of field corresponding to less than 60 m2 to obtain the number of seeds required to reach the LD50. It was also shown that this number of seeds is coherent with the amount of seeds ingested in a bout. In a pilot study, all grayish baywings fed with millet seeds treated with 3 g IMI/kg died within three to five days of exposure. In Tier I risk assessment, the trigger value was achieved for all crops except soybean and a weight-of-evidence risk assessment was performed. All lines of evidence examined are consistent with the view that grayish baywings, and probably other small farmland birds, are exposed to a risk of acute toxicity and mortality under both worst-case and mixed-ration exposure scenarios. The possible impacts on bird species calls for an urgent reconsideration of IMI seed coating practices currently approved in the Pampa Region of Argentina and the various parts of the world where this practice is still in use. © 2020 Elsevier B.V."
